<?xml version="1.0" encoding="UTF-8"?>
<families xmlns:xsi="http://www.w3.org/2001/XMLSchema-instance" xsi:schemaLocation="www.abis.be/families file:///C:/Users/Duser/Desktop/SmalsJava/XMLandSoap/Exercises/1.XML/ex3/families.xsd" xmlns="www.abis.be/families" xmlns:a="www.abis.be/address">
	<family>
		<familyName>Van Buggenhout - Schillebeeckx</familyName>
		<a:address zipcode="3000">
			<a:street>Somestreet</a:street>
			<a:nr>1</a:nr>
			<a:city>Kessel-Lo</a:city>
			<a:countryCode>BE</a:countryCode>
		</a:address>
		<members>
			<member>
				<name>
					<a:firstName>Sandy</a:firstName>
					<a:lastName>Schillebeeckx</a:lastName>
				</name>
				<birthdate>10/04/1978</birthdate>
				<gender>F</gender>
			</member>
			<member>
				<name>
					<a:firstName>Kristoff</a:firstName>
					<a:lastName>Van Buggenhout</a:lastName>
				</name>
				<birthdate>22/11/1979</birthdate>
				<gender>M</gender>
			</member>
		</members>
	</family>
	<family>
		<familyName>Wijnants-Otten</familyName>
		<a:address zipcode="2300 AB">
			<a:street>Somestreet</a:street>
			<a:nr>1</a:nr>
			<a:city>Turnhout</a:city>
			<a:countryCode>BE</a:countryCode>
		</a:address>
		<members>
			<member>
				<name>
					<a:firstName>Danny</a:firstName>
					<a:lastName>Wijnants</a:lastName>
				</name>
				<birthdate>18/01/1971</birthdate>
				<gender>M</gender>
			</member>
			<member>
				<name>
					<a:firstName>Peggy</a:firstName>
					<a:lastName>Otten</a:lastName>
				</name>
				<birthdate>06/06/1972</birthdate>
				<gender>F</gender>
			</member>
			<member>
				<name>
					<a:firstName>Robin</a:firstName>
					<a:lastName>Wijnants</a:lastName>
				</name>
				<birthdate>18/08/2000</birthdate>
				<gender>M</gender>
			</member>
			<member>
				<name>
					<a:firstName>Yoshin</a:firstName>
					<a:lastName>Wijnants</a:lastName>
				</name>
				<birthdate>04/09/2001</birthdate>
				<gender>M</gender>
			</member>
		</members>
		<pets>
			<pet>
				<species>dog</species>
				<name>Mona</name>
			</pet>
			<pet>
				<species>dog</species>
				<name>Hashi</name>
			</pet>
			<pet>
				<species>cat</species>
				<name>Felix</name>
			</pet>
		</pets>
	</family>
</families>
